Title,Abstract,Authors,Processed_Abstract,Processed_Title
Un coup de maître : ce génie candidate automatiquement à 1300 emplois grâce à l’IA,Une utilisation bluffante de cette technologie.,Jean-Yves Alric,une utilisation bluffante de cette technologie,un coup de maîtr ce génie candid automatiqu à 1300 emploi grâce à l ia
Le nombre de vidéos en français sur YouTube va exploser grâce à cette technologie,"Google déploie une technologie de doublage automatique qui peut rendre les vidéos YouTube anglaises disponibles en français, et vice-versa. Cela peut aider les créateurs à étendre leur communauté, tout en permettant aux utilisateurs de la plateforme de profit…",Setra,google déploie une technologie de doublage automatique qui peut rendre le vidéos youtube anglaises disponibles en français et cela peut aider le créateurs à étendre leur communauté tout en permettant aux utilisateurs de la plateforme de,le nombr de vidéo en françai sur youtub va explos grâce à cett technologi
L’IA va changer la façon dont vous lisez des livres d’après cet expert majeur,Le spécialiste a expliqué en quoi la technologie peut bousculer nos habitudes.,Jean-Yves Alric,le spécialiste expliqué en quoi la technologie peut bousculer no habitude,l ia va changer la façon dont vou lisez de livr aprè cet expert majeur
« Une batterie éternelle » : des scientifiques découvrent une technologie qui pourrait tout changer,"Afin de construire des batteries toujours plus endurantes, des chercheurs ont eu l'idée d'utiliser des diamants. Les résultats sont impressionnants.",Tristan Carballeda,afin de construire de battery toujours plus endurantes de chercheurs ont eu de diamants le résultats sont impressionnants,une batteri éternel de scientifiqu découvrent une technologi qui pourrait tout changer
Galaxy S25 : Samsung réinvente son assistant avec cette technologie,"Longtemps oublié, Bixby, l'assistant personnel de Samsung, fait son retour par la grande porte avec des fonctionnalités plus intelligentes. À chaque",Arthur Rafié,longtemps oublié bixby personnel de samsung fait son retour par la grande porte avec de fonctionnalités plus intelligentes à chaque,galaxi s25 samsung réinvent son assist avec cett technologi
"De l’entrée de gamme au monstre de puissance, voici 3 configurations PC idéales pour fin 2024 !","Dans un monde où la technologie évolue à un rythme effréné, choisir la configuration PC idéale peut s'avérer être un véritable défi.",Gregori Pujol,dans un monde où la technologie évolue à un rythme effréné choisir la configuration pc idéale peut être un véritable défi,de l entré de gamm au monstr de puissanc voici 3 configur pc idéal pour fin 2024
«Reconnecter la technologie aux communautés vivantes»,"Il est possible, si l’on ne veut pas abandonner l’avenir du numérique aux Big Tech, de s’engager dans des voies alternatives plus collectives et moins marchandes.",Benjamin Leclercq,il est possible si l ne veut pa abandonner l avenir du numérique aux big tech de engager dans de voies alternative plus collective et moins marchandes,reconnect la technologi aux communauté vivant
Une nouvelle génération de processeurs arrive en 2025 : “la technologie la plus avancée dans l’industrie des semi-conducteurs”,"TSMC publie de nouvelles informations sur les puces N2, une nouvelle génération de processeurs qui va révolutionner les performances sur les smartphones et certains PC. D’après celle-ci, ses clients sont déjà en train de valider leurs puces basées sur cette n…",Setra,tsmc publie de nouvelles information sur le puce n2 une nouvelle génération de processeurs qui va révolutionner le performance sur le smartphones et certains pc après s client sont déjà en train de valider leurs puce basées sur cette,une nouvel génération de processeur arriv en 2025 la technologi la plu avancé dan l industri de
Ces ingénieurs viennent d’humaniser les robots en leur donnant le sens du toucher,"Une équipe de chercheurs vient de dévoiler SonicSense, une technologie permettant aux robots d'interpréter leur environnement par les vibrations acoustiques.",Camille Coirault,une équipe de chercheurs vient de dévoiler sonicsense une technologie permettant aux robot leur environnement par le vibration acoustiques,ce ingénieur viennent humanis le robot en leur donnant le sen du toucher
"Starlink dans votre smartphone, ce sera bientôt possible","C’est officiel : les autorités américaines ont donné leur feu vert à SpaceX pour connecter directement les smartphones au réseau Starlink. En partenariat avec T-Mobile, cette nouvelle technologie apportera du signal dans les endroits les plus reculés.",Olivier,c est officiel le autorités américaines ont donné leur feu vert à spacex pour connecter directement le smartphones au réseau starlink en partenariat avec cette nouvelle technologie apportera du signal dans le endroits le plus reculés,starlink dan votr smartphon ce sera bientôt possibl
Piratage massif aux États-Unis : le FBI recommande les messageries chiffrées,"Une vaste cyberattaque menée par des pirates chinois cible les infrastructures télécoms américaines, poussant le FBI à conseiller l’utilisation de messageries chiffrées. Une posture surprenante pour une agence qui milite souvent contre cette technologie.",Olivier,une vaste cyberattaque menée par de pirate chinois cible le infrastructure télécoms américaines poussant le fbi à conseiller l utilisation de messageries chiffrées une posture surprenante pour une agence qui milite souvent contre cette technologie,piratag massif aux le fbi recommand le messageri chiffré
Test des Pixel Buds Pro 2 : l’IA de Google peut-elle transformer ces écouteurs true wireless en référence ?,"Avec l’intégration de la puce Tensor A1 et de la technologie Gemini, Google mise sur l’intelligence artificielle pour propulser la seconde génération de ses écouteurs premium. Mais cela suffit-il à respecter l’essentiel ?",Jean-Sébastien Zanchi,avec l intégration de la puce tensor a1 et de la technologie gemini google mise sur l intelligence artificielle pour propulser la seconde génération de s écouteurs premium mais cela à respecter l essentiel,test de pixel bud pro 2 l ia de googl transform ce écouteur true wireless en référenc
OpenAI s’allie à Anduril pour développer une IA militaire,"Comme de nombreux grands noms de l'IA, l'entreprise de Sam Altman continue sa percée dans ce domaine qu'elle s'engageait autrefois à rejeter.",Antoine Gautherie,comme de nombreux grand noms de de sam altman continue sa percée dans ce domaine autrefois à rejeter,openai alli à anduril pour développ une ia militair
Razer X Interhaptics : cette société lilloise est en train de révolutionner le monde,"Dans les locaux d’Interhaptics à Lille, une équipe de passionnés redéfinit notre façon d’interagir avec la technologie. Portrait d’une success-story à la française qui dépasse le cadre du gaming.",Robin Sabbadini,dans le locaux interhaptics à lille une équipe de passionnés redéfinit notre façon interagir avec la technologie portrait une à la française qui dépasse le cadre du gaming,razer x interhapt cett société lillois est en train de révolutionn le mond
Tesla et Rivian trouvent un accord après 4 ans de bataille juridique,Le conflit opposant les deux géants de la voiture électrique touche à sa fin. Tesla et Rivian ont annoncé un accord pour clore leur différend sur le présumé vol de technologie de batteries.,Robin Sabbadini,le conflit opposant le deux géants de la voiture électrique touche à sa fin tesla et rivian ont annoncé un accord pour clore leur différend sur le présumé vol de technologie de battery,tesla et rivian trouvent un accord aprè 4 an de batail juridiqu
LG dévoile sa nouvelle gamme QNED 2025 : technologie sans fil sans délai et jusqu’à 100 pouces,"Bien en amont du CES 2025, une partie de la nouvelle gamme de téléviseurs QNED evo 2025 de LG Electronics vient d’être officiellement dévoilée. Elle intègre des innovations majeures, notamment une technologie d'affichage sans fil, sans délai, des capacités d'…",Sylvain Pichot,bien en amont du ce 2025 une partie de la nouvelle gamme de téléviseurs qned evo 2025 de lg electronics vient être officiellement dévoilée elle intègre de innovation majeures notamment une technologie sans fil sans délai de capacités,lg dévoil sa nouvel gamm qned 2025 technologi san fil san délai et jusqu à 100 pouc
Voiture électrique : le fournisseur de Tesla annonce l’arrivée de batteries beaucoup moins chères,"Les voitures électriques abordables ne sont peut-être plus un rêve lointain. CATL, le plus grand fabricant mondial de batteries et fournisseur privilégié de Tesla, annonce une innovation majeure dans le domaine des batteries sodium.",Robin Sabbadini,le voitures électriques abordables ne sont plus un rêve lointain catl le plus grand fabricant mondial de battery et fournisseur privilégié de tesla annonce une innovation majeure dans le domaine de battery sodium,voitur électriqu le fournisseur de tesla annonc l arrivé de batteri beaucoup moin chère
1 000 km d’autonomie en voiture électrique : cette nouvelle technologie de batterie promet du lourd,"Les fabricants de batteries explorent plusieurs pistes pour ""l'après"" LFP (les batteries sans cobalt), en mettant l'accent notamment sur une meilleure densité énergétique et un poids plus contenu. Une récente étude révèle que les accumulateurs avec une anode …",Yann Lethuillier,le fabricants de battery explorent plusieurs piste pour lfp le battery sans cobalt en mettant notamment sur une meilleure densité énergétique et un poids plus contenu une récente étude révèle que le accumulateurs avec une anode,1 000 km autonomi en voitur électriqu cett nouvel technologi de batteri promet du lourd
Cette voiture électrique chinoise reprend la meilleure technologie du Cybertruck avec un volant révolutionnaire,"La Nio ET9, porte-étendard de la marque chinoise, continue de livrer ses secrets. Après avoir dévoilé sa charge ultra rapide ou sa suspension révolutionnaire, Nio vient de présenter son système de direction sans fil, baptisé ""steer-by-wire"", déjà présent sur …",Jean-Baptiste Passieux,la nio et9 de la marque chinoise continue de livrer s secret après avoir dévoilé sa charge ultra rapide ou sa suspension révolutionnaire nio vient de présenter son système de direction sans fil baptisé déjà présent sur,cett voitur électriqu chinois reprend la meilleur technologi du cybertruck avec un volant révolutionnair
"Les prochaines Apple Watch adopteraient enfin cette technologie, cinq ans après l’iPhone",Apple déciderait de passer enfin ses Apple Watch de la 4G à la 5G avec un nouveau modèle prévu pour intégrer ses montres connectées en 2025 L'Apple Watch,Geoffroy Husson,apple déciderait de passer enfin s apple watch de la 4g à la 5g avec un nouveau modèle prévu pour intégrer s montres connectées en 2025 watch,le prochain appl watch adopterai enfin cett technologi cinq an aprè l iphon
Apple préparerait déjà la prochaine révolution pour les écrans de MacBook,"Après avoir lancé son premier iPad Pro avec écran OLED en 2024, Apple préparerait l’arrivée des premiers MacBook OLED. D’après une récente publication de Trendforce, les MacBook OLED arriveraient entre 2026 et 2027, mais Apple aurait déjà demandé à ses fourni…",Setra,après avoir lancé son premier ipad pro avec écran oled en 2024 apple préparerait l arrivée de premier macbook oled après une récente publication de trendforce le macbook oled arriveraient entre 2026 et 2027 mais apple aurait déjà demandé à s,appl préparerait déjà la prochain révolut pour le écran de macbook
Un futur sans clics ni touches : cette IA redéfinit la façon dont on utilise les ordinateurs,"Dans un avenir proche, on pourra demander à une intelligence artificielle de réaliser des tâches sur notre PC, sans toucher aux claviers et à la souris. En s’appuyant sur une nouveauté d’Anthropic, la startup Hume AI donne un aperçu de ce qui sera possible.",Setra,dans un avenir proche pourra demander à une intelligence artificielle de réaliser de tâches sur notre pc sans toucher aux clavier et à la souris en appuyant sur une nouveauté anthropic la startup hume ai donne un aperçu de ce qui serum possible,un futur san clic ni touch cett ia redéfinit la façon dont utilis le ordinateur
Dossier : L'intelligence artificielle : une révolution technologique aux lourdes conséquences environnementales,L'intelligence artificielle consomme des quantités astronomiques d'électricité. Voici un panorama de l'impact environnemental actuel et prévisionnel de cette technologie.,Florent Lanne,artificielle consomme de quantités astronomiques voici un panorama de environnemental actuel et prévisionnel de cette technologie,dossier artificiel une révolut technologiqu aux lourd conséquenc environnemental
Samsung a déjà planché sur une batterie pliable pour ses futurs smartphones,"Un brevet Samsung décrit une batterie pliable qui permettrait d’optimiser la gestion de l’espace et l’autonomie des smartphones pliants. Mais pour le moment, rien ne garantit que Samsung va développer cette technologie.",Setra,un brevet samsung décrit une batterie pliable qui permettrait optimiser la gestion de l espace et l autonomie de smartphones pliants mais pour le moment rien ne garantit que samsung va développer cette technologie,samsung déjà planché sur une batteri pliabl pour se futur smartphon
HAMR - Seagate dévoile son disque dur de 32 To,"Vous aussi, vous pensiez que nos bons vieux disques durs appartenaient au passé et que, maintenant, seuls comptaient les mémoires flash ? Et bien détrompez-vous car le marché du stockage haute capacité n’a pas dit son dernier mot. La preuve avec Seagate qui v…",Korben,vous aussi vous pensiez que no bons vieux disques durs appartenaient au passé et que maintenant seuls comptaient le mémoires flash et bien car le marché du stockage haute capacité n pa dit son dernier mot la preuve avec seagate qui,hamr seagat dévoil son disqu dur de 32
"Genre, âge, handicap… L’IA renforce-t-elle les inégalités au travail ?",L’accès aux formations à l’IA varie drastiquement selon les catégories de personnes. Et c’est un gros problème.,Mathilde Rochefort,l accès aux formation à l ia varie drastiquement selon le catégories de personnes et c est un gros problème,genr âge l ia le inégalité au travail
Et si la navigation quantique remplaçait nos bons vieux GPS ?,"Le GPS pourrait bien devenir un outil du passé. Face aux limites des satellites, notamment en cas de brouillage ou en milieu hostile, l’armée américaine mise sur la navigation quantique. Une technologie qui pourrait bientôt guider avions, navires… et peut-êtr…",Olivier,le gps pourrait bien devenir un outil du passé face aux limites de satellite notamment en ca de brouillage ou en milieu hostile l armée américaine mise sur la navigation quantique une technologie qui pourrait bientôt guider avions et,et si la navig quantiqu remplaçait no bon vieux gp
MAX OLED : des écrans OLED plus grands à moindre coût,"Applied Materials vient de lever le voile sur sa plateforme MAX OLED, qui pourrait bien changer la donne dans l’industrie des écrans. En simplifiant la fabrication et en abaissant les coûts, cette technologie pourrait étendre l’usage de l'OLED bien au-delà de…",Olivier,applied material vient de lever le voile sur sa plateforme max oled qui pourrait bien changer la donne dans l industrie de écrans en simplifiant la fabrication et en abaissant le coûts cette technologie pourrait étendre l usage de bien,max ole de écran ole plu grand à moindr coût
La police utilise un hologramme de la victime pour relancer un Cold Case,"Quinze ans après le meurtre brutal de Bernadett « Betty » Szabó dans le quartier rouge d’Amsterdam, la police néerlandaise mise sur une technologie inédite pour raviver les souvenirs des témoins. Un hologramme grandeur nature de la jeune Hongroise, tuée en 20…",Olivier,quinze an après le meurtre brutal de bernadett betty szabó dans le quartier rouge amsterdam la police néerlandaise mise sur une technologie inédite pour raviver le souvenir de témoins un hologramme grandeur nature de la jeune hongroise tuée en,la polic utilis un hologramm de la victim pour relanc un cold case
Le Dolby Atmos a un nouveau rival,"L'entreprise britannique Audioscenic vient d’annoncer le développement d'Amphi Hi-D, une technologie de son spatial multicanal qui promet de transformer l'expérience audio des utilisateurs sans nécessiter de casque et qui compte bien rivaliser avec l’omniprés…",Sylvain Pichot,britannique audioscenic vient annoncer le développement une technologie de son spatial multicanal qui promet de transformer audio de utilisateurs sans nécessiter de casque et qui compte bien rivaliser avec l,le dolbi atmo un nouveau rival
Un capot qui a du ressort : Volkswagen booste la sécurité des piétons,"La sécurité des piétons reste une priorité pour les constructeurs automobiles. Volkswagen a dévoilé un système de « capot actif » sur l’ID.7, une nouveauté pour réduire les blessures lors d’un éventuel impact avec un piéton.",Olivier,la sécurité de piétons reste une priorité pour le constructeurs automobile volkswagen dévoilé un système de capot actif sur l une nouveauté pour réduire le blessures lors un éventuel impact avec un piéton,un capot qui du ressort volkswagen boost la sécurité de piéton
Apple préparerait une version “LLM” de Siri pour 2026 : qu’est-ce que ça change ?,"Siri préparerait une version améliorée de Siri, qui serait plus proche de ChatGPT et de Gemini. La marque à la pomme pourrait présenter cette nouveauté en 2025, puis lancer celle-ci au printemps 2026.",Setra,siri préparerait une version améliorée de siri qui serait plus proche de chatgpt et de gemini la marque à la pomme pourrait présenter cette nouveauté en 2025 puis lancer au printemps 2026,appl préparerait une version llm de siri pour 2026 qu que ça chang
Actualité : Tencent se lance sur le marché des consoles PC portable avec une technologie inspirée par Nintendo,"Tencent vient de lever le voile sur la Sunday Dragon 3D One, développée en partenariat avec Intel. Comme la 3DS avant elle, cette ""console-portable-PC-gamer"" serait capable de donner l'illusion de la 3D sans aucun besoin de lunettes adaptées.",Henry Grimaud,tencent vient de lever le voile sur la sunday dragon 3d one développée en partenariat avec intel comme la 3d avant elle cette serait capable de donner de la 3d sans aucun besoin de lunette adaptées,actualité tencent se lanc sur le marché de consol pc portabl avec une technologi inspiré par nintendo
Google révolutionne l’informatique quantique avec sa puce Willow,"Google vient de franchir une étape historique dans l'informatique quantique avec sa nouvelle puce Willow, qui représente une avancée majeure dans deux domaines critiques.",Gregori Pujol,google vient de franchir une étape historique dans quantique avec sa nouvelle puce willow qui représente une avancée majeure dans deux domaines critique,googl révolutionn l informatiqu quantiqu avec sa puce willow
Volkswagen veut améliorer la sécurité des piétons avec cette idée atypique pour ses voitures,"La sécurité des piétons reste une priorité pour les constructeurs automobiles. Volkswagen a dévoilé un système de « capot actif » sur l’ID.7, une nouveauté pour réduire les blessures lors d’un éventuel impact avec un piéton.",Olivier,la sécurité de piétons reste une priorité pour le constructeurs automobile volkswagen dévoilé un système de capot actif sur l une nouveauté pour réduire le blessures lors un éventuel impact avec un piéton,volkswagen veut amélior la sécurité de piéton avec cett idé atypiqu pour se voitur
"Le prix des brosses à dents sonique de Oclean est en forte baisse, attention stock limité !",Révolutionnez votre hygiène dentaire avec les brosses à dents électriques Oclean à prix canon pour Black Friday !,Partenaire,révolutionnez votre hygiène dentaire avec le brosses à dent électriques oclean à prix canon pour black friday,le prix de bross à dent soniqu de oclean est en fort baiss attent stock limité
The Premiere de Samsung devient le premier projecteur certifié 8K,"The Premiere 8K, que Samsung présentait pour la première fois au CES 2024, vient d'obtenir la certification 8KA de la part de l'association du même nom.",Jason Filankembo,premiere 8k que samsung présentait pour la première fois au ce 2024 vient la certification 8ka de la part de du même nom,premier de samsung devient le premier projecteur certifié 8k
Fugatto - L'IA qui transforme n'importe quel son à la demande,"Les magiciens de chez NVIDIA viennent de dévoiler une technologie qui va faire trembler le monde de l’audio. Son petit nom ? Fugatto, un modèle d’intelligence artificielle qui transforme littéralement n’importe quel son sur simple demande textuelle.
Cette IA …",Korben,le magiciens de chez nvidia viennent de dévoiler une technologie qui va faire trembler le monde de l audio son petit nom fugatto un modèle intelligence artificielle qui transforme littéralement n importe quel son sur simple demande textuelle cette ia,fugatto qui transform quel son à la demand
Neuralink veut révolutionner la santé avec des bras robotisés contrôlés par la pensée,"Neuralink, l’entreprise de neurotechnologie d’Elon Musk, lance une nouvelle phase d’expérimentation prometteuse.",Robin Sabbadini,neuralink l entreprise de neurotechnologie elon musk lance une nouvelle phase expérimentation prometteuse,neuralink veut révolutionn la santé avec de bra robotisé contrôlé par la pensé
"Tout savoir sur “Gauss2”, la nouvelle IA développée par Samsung","Samsung vient de présenter Gauss2, une nouvelle version de son concurrent de ChatGPT. Celui-ci est déjà utilisé en interne pour augmenter la productivité de Samsung, et la marque coréenne a toujours l’intention de proposer cette technologie à ses clients. Par…",Setra,samsung vient de présenter gauss2 une nouvelle version de son concurrent de chatgpt est déjà utilisé en interne pour augmenter la productivité de samsung et la marque coréenne toujours l intention de proposer cette technologie à s client,tout savoir sur gauss2 la nouvel ia développé par samsung
Apple aurait franchi un pas de plus vers l’iPhone pliable,Apple aurait débuté le “processus de développement officiel” de son futur iPhone pliable.,Setra,apple aurait débuté le processus de développement officiel de son futur iphone pliable,appl aurait franchi un pa de plu ver l iphon pliabl
"En 2010 il fallait payer 10 000 Bitcoins pour une pizza, il vient maintenant de dépasser les 100 000 dollars",Le Bitcoin vient de franchir un cap historique en dépassant les 100 000 dollars. Un moment symbolique qui nous rappelle le chemin parcouru depuis la première transaction « réelle » en Bitcoin : l’achat de deux pizzas pour 10 000 BTC en 2010.,Robin Sabbadini,le bitcoin vient de franchir un cap historique en dépassant le 100 000 dollar un moment symbolique qui nous rappelle le chemin parcouru depuis la première transaction réelle en bitcoin l achat de deux pizza pour 10 000 btc en 2010,en 2010 il fallait payer 10 000 bitcoin pour une pizza il vient mainten de dépasser le 100 000 dollar
Cyclone Chido à Mayotte : la technologie spatiale du Cnes au service des secours,"Le Centre national d’études spatiales a activé ce lundi 16 décembre le Copernicus Emergency Management Service, dispositif permettant de mobiliser les images satellites pour l’aide humanitaire sur l’archipel dévasté.",Samuel Ravier-Regnat,le centre national études spatiales activé ce lundi 16 décembre le copernicus emergency management service dispositif permettant de mobiliser le image satellite pour l aide humanitaire sur l archipel dévasté,cyclon chido à mayott la technologi spatial du cne au servic de secour
Voici pourquoi vous prenez un risque quand vous échangez un texto RCS entre iPhone et Android,"Dans un communiqué, Samsung se réjouit de l’adoption du protocole RCS par l’iPhone, mais il rappelle que le chiffrement qui sécurise les discussions n’est disponible que pour les textos entre smartphones Android.",Setra,dans un communiqué samsung se réjouit de l adoption du protocole rcs par l iphone mais il rappelle que le chiffrement qui sécurise le discussion n est disponible que pour le textos entre smartphones android,voici pourquoi vou prenez un risqu quand vou échangez un texto rc entr iphon et android
Actualité : Galaxy S25 Plus : des images du smartphone apparaissent avec un détail intriguant,"La sortie du Galaxy S25 se rapproche alors forcément, les fuites se multiplient. Aujourd’hui, de nouvelles images de la version Plus apparaissent.",Nassim Chentouf,la sortie du galaxy s25 se rapproche alors forcément le fuites se multiplient aujourd hui de nouvelles image de la version plus apparaissent,actualité galaxi s25 plu de imag du smartphon apparaiss avec un détail intrigu
