Title,Abstract,Authors,Processed_Abstract,Processed_Title
Actualité : Shoei et Eyelights présentent un casque moto qui va révolutionner la sécurité,"Shoei a profité de l’EICMA 2024 pour présenter le fruit de son partenariat avec Eyelights, une entreprise française spécialisé dans l’affichage tête haute pour moto.","Nicolas Luciu, Jérémy Fdida",shoei profité de l eicma 2024 pour présenter le fruit de son partenariat avec eyelights une entreprise française spécialisé dans l affichage tête haute pour moto,actualité shoei et eyelight présentent un casqu moto qui va révolutionn la sécurité
Actualité : iPhone 17 Pro et Pro Max : Apple aurait du nouveau pour l’écran,"L’écran des iPhone 17 Pro et 17 Pro Max vient de faire parler de lui. D’après une récente rumeur, Apple opterait pour une nouvelle technologie de dalle aux multiples avantages, notamment du côté de la consommation énergétique.",Alexandre Scotti,l écran de iphone 17 pro et 17 pro max vient de faire parler de lui après une récente rumeur apple opterait pour une nouvelle technologie de dalle aux multiple avantages notamment du côté de la consommation énergétique,actualité iphon 17 pro et pro max appl aurait du nouveau pour l écran
"Actualité : Charge SuperSonic, capacité accrue : Realme veut redéfinir l’avenir des batteries de smartphones","Les utilisateurs de smartphones chinois bénéficient souvent d'innovations étonnantes que leurs concurrents tardent à intégrer. Entre charge ultra-rapide et batteries de grande capacité, certains constructeurs comme Realme tentent de repousser les limites de l…",Julien Vercoutère,le utilisateurs de smartphones chinois bénéficient souvent étonnantes que leurs concurrents tardent à intégrer entre charge et battery de grande capacité certains constructeurs comme realme tentent de repousser le limites de,actualité charg superson capacité accru realm veut redéfinir l avenir de batteri de smartphon
"Dans le rush du Black Friday, Amazon oublie sa marge sur cette TV 4K Philips 55″ ","Vous souhaitez vous équiper d'une nouvelle TV, mais vous n'avez pas un gros budget à y consacrer ? Amazon propose justement une remise CHOC sur ce téléviseur 4K Philips de 50 pouces, qui passe à un prix on ne peut plus abordable.",Journal du Geek,vous souhaitez vous équiper nouvelle tv mais vous pa un gros budget à consacrer amazon propose justement une remise choc sur ce téléviseur 4k philip de 50 pouces qui passe à un prix ne peut plus abordable,dan le rush du black friday amazon oubli sa marg sur cett tv 4k philip
Live de Noël : à vous l’aspirateur de vos rêves ECOVACS !,"À l’occasion de notre Live spécial Noël, on a décidé de vous offrir de quoi vous simplifier le quotidien avec ECOVACS.",Partenaire,à l occasion de notre live spécial noël décidé de vous offrir de quoi vous simplifier le quotidien avec ecovacs,live de noël à vou l aspirateur de vo rêve ecovac
"À J-12 de Noël, ce téléviseur Philips 4K Ambilight de 65″ est proposé à un prix vraiment avantageux","Grâce à une généreuse remise concédée par Amazon, la TV 4K Philips PUS8109 de 65 pouces avec Ambilight devient bien plus avantageuse. C'est l'occasion rêvée de s'offrir un nouveau téléviseur, ou de faire plaisir à vos proches pour Noël.",Journal du Geek,grâce à une généreuse remise concédée par amazon la tv 4k philip pus8109 de 65 pouces avec ambilight devient bien plus avantageuse rêvée de un nouveau téléviseur ou de faire plaisir à vos proches pour noël,à de noël ce téléviseur philip 4k ambilight de est proposé à un prix vraiment avantageux
Les passkeys - La meilleure méthode de connexion (sans mot de passe),"Adieu les mots de passe compliqués à retenir, bonjour les passkeys ! Cette technologie nouvelle est en train de modifier radicalement la façon dont nous nous connectons à nos comptes en ligne. Alors que la gestion des mots de passe devient de plus en plus con…",Korben,adieu le mot de passe compliqués à retenir bonjour le passkey cette technologie nouvelle est en train de modifier radicalement la façon dont nous nous connectons à no comptes en ligne alors que la gestion de mot de passe devient de plus en plus,le passkey la meilleur méthode de connexion san mot de pass
“Make games great again” : Elon Musk veut lancer son propre studio de jeux vidéo,"Elon Musk annonce la création d’un studio de jeux vidéo qui s’appuiera sur l’intelligence artificielle au sein de son laboratoire d’IA xAI. Lancé en 2023, xAI est un concurrent d’OpenAI qui a déjà développé une technologie baptisée Grok pour rivaliser avec ce…",Setra,elon musk annonce la création un studio de jeux vidéo qui appuiera sur l intelligence artificielle au sein de son laboratoire ia xai lancé en 2023 xai est un concurrent openai qui déjà développé une technologie baptisée grok pour rivaliser avec,make game great elon musk veut lancer son propr studio de jeux vidéo
Black Friday Samsung : cet écran PC gaming Odyssey OLED est à -40% sur Amazon ,"L'écran PC Gaming Odyssey OLED G6 est vraiment le must pour jouer. Pour le Black Friday, Amazon lui applique une remise ultra généreuse de -40%. Il faut cependant vous dépêcher car le stock est déjà presque épuisé.",Journal du Geek,pc gaming odyssey oled g6 est vraiment le must pour jouer pour le black friday amazon lui applique une remise ultra généreuse de il faut cependant vous dépêcher car le stock est déjà presque épuisé,black friday samsung cet écran pc game odyssey ole est à sur amazon
Pourquoi Free vient d’être condamné pour publicité trompeuse ?,L’opérateur fait les frais de poursuites datant de 2021.,Jean-Yves Alric,l opérateur fait le frais de poursuites datant de 2021,pourquoi free vient être condamné pour publicité trompeus
"En 2010 il fallait payer 10 000 BTC pour une pizza, le Bitcoin vient maintenant de dépasser les 100 000 dollars",Le Bitcoin vient de franchir un cap historique en dépassant les 100 000 dollars. Un moment symbolique qui nous rappelle le chemin parcouru depuis la première transaction « réelle » en Bitcoin : l’achat de deux pizzas pour 10 000 BTC en 2010.,Robin Sabbadini,le bitcoin vient de franchir un cap historique en dépassant le 100 000 dollar un moment symbolique qui nous rappelle le chemin parcouru depuis la première transaction réelle en bitcoin l achat de deux pizza pour 10 000 btc en 2010,en 2010 il fallait payer 10 000 btc pour une pizza le bitcoin vient mainten de dépasser le 100 000 dollar
Galaxy S25 : Samsung prendrait enfin en charge la norme sans fil Qi2,"La future série Samsung Galaxy S25 s'annonce plus intéressante que prévu. Selon le leaker réputé Ice Universe, ces smartphones pourraient intégrer la technologie de charge sans fil Qi2, marquant potentiellement un tournant majeur pour l'écosystème Android.",William Zimmer,la future série samsung galaxy s25 plus intéressante que prévu selon le leaker réputé ice universe ce smartphones pourraient intégrer la technologie de charge sans fil qi2 marquant potentiellement un tournant majeur pour android,galaxi s25 samsung prendrait enfin en charg la norm san fil qi2
nubia Z70 Ultra : le nouveau flagship killer ?,"Le monde des smartphones est en constante évolution, mais rares sont les appareils qui parviennent véritablement à redéfinir les standards de l'industrie. Pourtant le nubia Z70 Ultra semble bien parti pour faire parler de lui dans les prochaines semaines.",Gregori Pujol,le monde de smartphones est en constante évolution mais rares sont le appareils qui parviennent véritablement à redéfinir le standard de pourtant le nubia z70 ultra semble bien parti pour faire parler de lui dans le prochaines semaines,nubia z70 ultra le nouveau flagship killer
Android 16 intègre enfin le partage audio par Bluetooth Auracast,"La dernière version d'Android, actuellement en phase de développement, apporte une fonctionnalité attendue : le partage audio multiple via la technologie Auracast. Cette dernière permet de diffuser simultanément du contenu audio vers plusieurs appareils Bluet…",Sylvain Pichot,la dernière version actuellement en phase de développement apporte une fonctionnalité attendue le partage audio multiple via la technologie auracast cette dernière permet de diffuser simultanément du contenu audio vers plusieurs appareils,android 16 intègr enfin le partag audio par bluetooth auracast
« Une requête sur ChatGPT demande 10 fois plus d’énergie qu’une recherche sur Google » : l’impact énergétique de l’IA au cœur des débats,"Véritable révolution industrielle et technologie, l'essor de l'intelligence artificielle soulève des questions en termes d’impact environnemental. Un congrès à Paris, organisé par l'Agence internationale de l'énergie, réunit industriels et politiques pour exp…",Arthur Rafié,véritable révolution industrielle et technologie de artificielle soulève de question en termes impact environnemental un congrès à paris organisé par internationale de réunit industriels et politiques pour,une requêt sur chatgpt demand 10 foi plu énergi qu une recherch sur googl l impact énergétiqu de l ia au cœur de débat
Le rétrogaming à l’honneur avec cette console de poche Anbernic RG35XXSP à petit prix pour la Black Friday Week,"L'Anbernic RG35XXSP est une console rétro qui n'est pas sans rappeler une certaine Game Boy Advance SP, permettant de jouer à d'anciens jeux avec la technologie moderne et surtout un prix inférieur à 50 euros.",Benjamin Barois,rg35xxsp est une console rétro qui pa sans rappeler une certaine game boy advance sp permettant de jouer à jeux avec la technologie moderne et surtout un prix inférieur à 50 euro,le rétrogam à l honneur avec cett consol de poch anbern rg35xxsp à petit prix pour la black friday week
Les Nvidia RTX 5000 proposeront un “rendu neuronal” pour révolutionner le rendu 3D des jeux selon ce partenaire,"Une récente fuite sur les prochains GPU Nvidia promet une petite ""révolution"" avec l'arrivée du ""rendu neuronal"", une mystérieuse technologie qui sera annoncée en janvier prochain par la firme.",Hugo Clery,une récente fuite sur le prochains gpu nvidia promet une petite révolution avec du rendu neuronal une mystérieuse technologie qui serum annoncée en janvier prochain par la firme,le nvidia rtx 5000 proposeront un rendu neuron pour révolutionn le rendu 3d de jeux selon ce partenair
"Cyber Monday : la manette PS5 DualSense de nouveau à son plus bas prix, mais uniquement aujourd’hui ","La manette sans-fil DualSense pour PS5 est victime des promos folles de Cyber Monday. Rakuten n'hésite pas à casser son prix, si bien qu'il tombe à un niveau encore jamais vu auparavant.",Journal du Geek,la manette dualsense pour ps5 est victime de promos folles de cyber monday rakuten pa à casser son prix si bien tombe à un niveau encore jamais vu auparavant,cyber monday la manett ps5 dualsens de nouveau à son plu ba prix mai uniqu aujourd hui
Une batterie au diamant qui pourrait durer des millénaires,"Et si vos appareils fonctionnaient pendant des milliers d’années sans recharge ? C’est l’idée derrière la batterie au diamant de carbone-14, développée par des chercheurs anglais. Leur concept pourrait transformer complètement la façon dont nous utilisons l’é…",Olivier,et si vos appareils fonctionnaient pendant de milliers années sans recharge c est l idée derrière la batterie au diamant de développée par de chercheurs anglais leur concept pourrait transformer complètement la façon dont nous utilisons l,une batteri au diamant qui pourrait durer de millénair
Manifestation chez les comédiens de doublage : la VF menacée par l’IA ?,Les comédiens de doublage se rassemblent pour interpeller les politiques et sensibiliser le public à l'utilisation de l'intelligence artificielle dans le milieu de la voix. Ils appellent l'État à réguler cette technologie.,Arthur Rafié,le comédiens de doublage se rassemblent pour interpeller le politiques et sensibiliser le public à de artificielle dans le milieu de la voix il appellent à réguler cette technologie,manifest chez le comédien de doublag la vf menacé par l ia
Comment Mercedes pourrait augmenter l’autonomie de ses voitures électriques de 20 000 km par an « gratuitement »,"Le constructeur allemand Mercedes vient de dévoiler une technologie surprenante, prenant la forme d’une peinture solaire. Appliquée sur une voiture électrique, elle permettrait de parcourir jusqu’à 20 000 kilomètres par an sans se recharger.",Marie Lizak,le constructeur allemand mercedes vient de dévoiler une technologie surprenante prenant la forme une peinture solaire appliquée sur une voiture électrique elle permettrait de parcourir jusqu à 20 000 kilomètres par sans se recharger,comment merced pourrait augment l autonomi de se voitur électriqu de 20 000 km par gratuit
"« 299 » : en une phrase, PlayStation a révolutionné le jeu vidéo","La Sony PlayStation fête ses 30 ans au Japon, le pays qui a vu naitre la console de jeu. Un prix cassé, une nouvelle technologie et un nouveau public cible ont permis à Sony de s'imposer face à Nintendo.",Cassim Montilla,la sony playstation fête s 30 an au japon le pay qui vu naitre la console de jeu un prix cassé une nouvelle technologie et un nouveau public cible ont permis à sony de face à nintendo,299 en une phrase playstat révolutionné le jeu vidéo
Nintendo lance de nouveaux écouteurs sans fil aux couleurs de Tetris,"Nintendo surprend une fois de plus ses fans avec le lancement d'écouteurs sans fil inspirés de l'univers Tetris. Ce nouveau produit, développé en partenariat avec OTL Technologies, marie habilement nostalgie vidéoludique et technologie audio moderne.",William Zimmer,nintendo surprend une fois de plus s fan avec le lancement sans fil inspirés de tetri ce nouveau produit développé en partenariat avec otl technology marie habilement nostalgie vidéoludique et technologie audio moderne,nintendo lanc de nouveaux écouteur san fil aux couleur de tetri
Philips 55OLED759 : ce téléviseur 4K avec de la lumière dynamique est à -40 % pour la Black Friday Week,"Pour la Black Friday Week chez Carrefour, vous retrouvez le Philips 55OLED759, un TV 4K équipé de la technologie Ambilight en promo à 999 euros au lieu de 1 599 euros.",Benjamin Barois,pour la black friday week chez carrefour vous retrouvez le philip 55oled759 un tv 4k équipé de la technologie ambilight en promo à 999 euro au lieu de 1 599 euro,philip 55oled759 ce téléviseur 4k avec de la lumièr dynamiqu est à pour la black friday week
Fini les recherches à la truelle : voici comment Google Gemini va corriger vos requêtes bancales,"Google continue d'intégrer l'intelligence artificielle dans l'ensemble de ses produits. Après avoir doté Gemini de la capacité de résumer les dossiers Drive, le géant de la technologie expérimente maintenant une nouvelle fonctionnalité de suggestions IA dans …",William Zimmer,google continue artificielle dans de s produits après avoir doté gemini de la capacité de résumer le dossier drive le géant de la technologie expérimente maintenant une nouvelle fonctionnalité de suggestion ia dans,fini le recherch à la truell voici comment googl gemini va corrig vo requêt bancal
INMO AIR 3 : ces lunettes de réalité augmentée sont révolutionnaires,La firme chinoise INMO vient de présenter les premières lunettes AR autonomes au monde dotées de nouveaux écrans micro-OLED Sony en couleur.,Thomas Estimbre,la firme chinoise inmo vient de présenter le premières lunette ar autonomes au monde dotées de nouveaux écrans sony en couleur,inmo air 3 ce lunett de réalité augmenté sont révolutionnair
Black Friday : 6 pépites à ne pas manquer chez Boulanger ,"Le Black Friday 2024 bat son plein, offrant une multitude d'opportunités pour réaliser des économies substantielles sur vos achats. Cette année, l'événement a officiellement débuté aujourd'hui, le vendredi 29 novembre, mais de nombreux commerçants ont lancé l…",Journal du Geek,le black friday 2024 bat son plein offrant une multitude pour réaliser de économies substantielles sur vos achats cette année officiellement débuté le vendredi 29 novembre mais de nombreux commerçants ont lancé,black friday 6 pépite à ne pa manquer chez boulang
Actualité : CES 2025 – Dell veut révolutionner le refroidissement des PC portables,"Dell devrait présenter au CES un nouveau système de refroidissement sans ventilateur pour ses PC portables. Contrairement au AirJet de Frore System, le système ne fait pas vibrer l’air, mais l’ionise pour le déplacer.",Guillaume Henri,dell devrait présenter au ce un nouveau système de refroidissement sans ventilateur pour s pc portable contrairement au airjet de frore system le système ne fait pa vibrer l air mais l ionise pour le déplacer,actualité ce 2025 dell veut révolutionn le refroidiss de pc portabl
"Qui est Mago, la startup d’IA qui veut révolutionner le monde de la vidéo ?",Sa promesse : styliser n’importe quel type de vidéo dans n’importe quelle esthétique.,Mathilde Rochefort,sa promesse styliser n importe quel type de vidéo dans n importe quelle esthétique,qui est mago la startup ia qui veut révolutionn le mond de la vidéo
"Actualité : Google dévoile Willow, sa nouvelle puce quantique","Ce lundi 9 décembre, Google a dévoilé Willow, sa nouvelle puce quantique capable d'effectuer en quelques minutes des opérations que certains des plus puissants ordinateurs pourraient mettre des milliards d'années à calculer.",Benoit Bayle,ce lundi 9 décembre google dévoilé willow sa nouvelle puce quantique capable en quelques minute de opérations que certains de plus puissants ordinateurs pourraient mettre de milliard à calculer,actualité googl dévoil willow sa nouvel puce quantiqu
Comprendre l’informatique distribuée : la technologie qui fait tourner le web moderne,"À chaque clic ou à chaque recherche web, votre requête mobilise non pas un seul ordinateur, mais des dizaines, parfois des centaines de machines qui collaborent en temps réel. Cette approche, baptisée informatique distribuée, constitue le socle technologique …",Camille Coirault,à chaque clic ou à chaque recherche web votre requête mobilise non pa un seul ordinateur mais de dizaines parfois de centaines de machine qui collaborent en temp réel cette approche baptisée informatique distribuée constitue le socle technologique,comprendr l informatiqu distribué la technologi qui fait tourner le web modern
Top 3 des aspirateurs premium Dyson remisés pour Black Friday,"Pour le Black Friday, Dyson lève le voile sur des promotions exceptionnelles. Découvrez notre sélection des offres à saisir d’urgence.",Presse-citron,pour le black friday dyson lève le voile sur de promotion exceptionnelles découvrez notre sélection de offres à saisir urgence,top 3 de aspirateur premium dyson remisé pour black friday
La startup de Sam Altman (ChatGPT) cartonne grâce au nucléaire… et à l’IA,Son entreprise vient de signer un accord majeur.,Jean-Yves Alric,son entreprise vient de signer un accord majeur,la startup de sam altman chatgpt cartonn grâce au et à l ia
Cette IA météo de Google écrase la concurrence : une révolution pour les prévisions,Une innovation impressionnante de la part de Google.,Jean-Yves Alric,une innovation impressionnante de la part de google,cett ia météo de googl écrase la concurr une révolut pour le prévision
Voitures électriques : Mercedes vient de présenter un système de freins éternels révolutionnaires,Mercedes-Benz révolutionne le système de freinage des voitures électriques avec une innovation majeure. Une avancée technologique pourrait marquer un tournant décisif dans l’industrie automobile.,Robin Sabbadini,révolutionne le système de freinage de voitures électriques avec une innovation majeure une avancée technologique pourrait marquer un tournant décisif dans l industrie automobile,voitur électriqu merced vient de présenter un systèm de frein éternel révolutionnair
"AMD Radeon RX 8000 / RDNA 4 : puissance, technologie, prix, date de sortie… tout ce qu’on sait sur les prochaines cartes graphiques de AMD","AMD prépare son retour sur le marché des cartes graphiques en 2025 avec son architecture RDNA 4. On s'attend à de nombreuses nouveautés côté performance, ray tracing, mais aussi IA. Nous avons regroupé toutes les fuites et rumeurs les plus plausibles sur ces …",Hugo Clery,amd prépare son retour sur le marché de carte graphiques en 2025 avec son architecture rdna à de nombreuses nouveautés côté performance ray tracing mais aussi ia nous avon regroupé toutes le fuites et rumeurs le plus plausibles sur ce,amd radeon rx 8000 rdna 4 puissanc technologi prix date de tout ce qu sait sur le prochain cart graphiqu de amd
"Black Friday : Jusqu’à 50% de réduction sur la gamme soundcore, pour profiter du meilleur son au meilleur prix","C’est le moment parfait pour les amateurs de musique et de technologie : à l’occasion du Black Friday, Anker propose jusqu’à 50% de remise sur la gamme soundcore. Avec des prix défiants toute concurrence et un son de qualité, vous trouverez forcément de quoi …",Lou-Anne MOREL,c est le moment parfait pour le amateur de musique et de technologie à l occasion du black friday anker propose jusqu à 50 de remise sur la gamme soundcore avec de prix défiants toute concurrence et un son de qualité vous trouverez forcément de quoi,black friday jusqu à 50 de réduction sur la gamm soundcor pour profit du meilleur son au meilleur prix
"Amazon investit à nouveau 4 milliards de dollars dans Anthropic, le concurrent d’OpenAI","Amazon a officialisé un nouvel investissement de 4 milliards de dollars dans Anthropic, la startup qui défie le créateur de ChatGPT.",Setra,amazon officialisé un nouvel investissement de 4 milliard de dollar dans anthropic la startup qui défie le créateur de chatgpt,amazon investit à nouveau 4 milliard de dollar dan anthrop le concurr openai
Stellantis mise sur des batteries 2 fois moins chères et plus rapides à recharger,"Stellantis officialise un partenariat avec la société Zeta Energy qui lui permettra d’utiliser des batteries lithium-soufre d’ici 2030. Ces batteries seront plus légères, moins chères et plus rapides à recharger.",Setra,stellantis officialise un partenariat avec la société zeta energy qui lui permettra utiliser de battery ici ce battery seront plus légères moins chères et plus rapides à recharger,stellanti mise sur de batteri 2 foi moin chère et plu rapid à recharg
Google présente un nouveau générateur de vidéos qui défie Sora : qui peut y accéder ?,"Google lance un nouveau modèle de génération de vidéo baptisé Veo 2. Celui-ci serait de meilleure qualité que les modèles concurrents, et il est capable de créer des vidéos de plusieurs minutes en résolution 4K.",Setra,google lance un nouveau modèle de génération de vidéo baptisé veo serait de meilleure qualité que le modèles concurrents et il est capable de créer de vidéos de plusieurs minute en résolution 4k,googl présent un nouveau générateur de vidéo qui défie sora qui peut accéder
Duel : AirPods 4 ANC vs AirPods 4 : les clones d'Apple entrent en guerre !,"Avec les AirPods 4 ANC, Apple a enfin décidé d’octroyer un système de réduction du bruit à ses célèbres écouteurs sans-fil ouverts. L’intégration de cette fameuse technologie suffirait-elle donc à les rendre plus attractifs que les AirPods 4 classiques ? Que …",Arthur Letang,avec le airpods 4 anc apple enfin décidé octroyer un système de réduction du bruit à s célèbres écouteurs ouverts l intégration de cette fameuse technologie donc à le rendre plus attractifs que le airpods 4 classiques que,duel airpod 4 anc vs airpod 4 le clone entrent en guerr
Le Galaxy S25 pourrait devenir un véritable smartphone gaming grâce à cette nouveauté,Samsung se préparerait à faire du Galaxy S25 un excellent smartphone pour le jeu vidéo grâce à une nouvelle fonctionnalité. De quoi révolutionner le gaming sur mobile ? Peut-être bien.,William Zimmer,samsung se préparerait à faire du galaxy s25 un excellent smartphone pour le jeu vidéo grâce à une nouvelle fonctionnalité de quoi révolutionner le gaming sur mobile bien,le galaxi s25 pourrait devenir un véritabl smartphon game grâce à cett nouveauté
"Actualité : Après les iPad Pro, l’iPad mini d'Apple s’apprête à goûter aux écrans Oled","Alors que la technologie est reine chez les iPhone et Apple Watch, l’Oled s’apprête à faire une percée après les iPad Pro M4 sur les iPad mini et Air ou encore les MacBook Pro et Air au cours des prochaines années. Voici les plans d’Apple !",Alexandre Scotti,alors que la technologie est reine chez le iphone et apple watch l oled apprête à faire une percée après le ipad pro m4 sur le ipad mini et air ou encore le macbook pro et air au cours de prochaines années voici le plan apple,actualité aprè le ipad pro l ipad mini apprêt à goûter aux écran ole
"Actualité : Top produit – La carte graphique Nvidia GeForce RTX 4060 KFA2 à 278,99 €","La carte graphique Nvidia GeForce RTX 4060 KFA2 s'affiche aujourd'hui à 278,99 € chez Top Achat.",Rick,la carte graphique nvidia geforce rtx 4060 kfa2 à chez top achat,actualité top produit la cart graphiqu nvidia geforc rtx 4060 kfa2 à
