Title,Abstract,Authors,Processed_Abstract,Processed_Title
Adobe supprime enfin les reflets sur vos photos,"Photographes amateurs et professionnels, soyez joie car Adobe vient de dévoiler une technologie qui va résoudre l’un des casse-têtes les plus frustrants de la photographie : les reflets dans les vitres. Plus besoin de vous casser la tête sur Photoshop à tente…",Korben,photographes amateur et professionnels soyez joie car adobe vient de dévoiler une technologie qui va résoudre l un de le plus frustrants de la photographie le reflets dans le vitres plus besoin de vous casser la tête sur photoshop à,adob supprim enfin le reflet sur vo photo
"Actualité : Bon plan – Le casque vélo Bontrager Starvos Wavecel Jaune ""5 étoiles"" à 59,88 € (-17%)",Le casque vélo Bontrager Starvos Wavecel Jaune passe sous les 60 € chez Alltricks soit une baisse d'environ 17% sur le prix habituellement constaté. C'est actuellement l'un des meilleurs produit de notre comparatif.,Rick,le casque vélo bontrager starvos wavecel jaune passe sou le 60 chez alltricks soit une baisse 17 sur le prix habituellement constaté actuellement de meilleurs produit de notre comparatif,actualité bon plan le casqu vélo bontrag starvo wavecel jaun 5 étoil à
"Actualité : Bon plan – Le casque vélo Bontrager Starvos Wavecel Jaune ""5 étoiles"" à 59,88 € (-17%)",Le casque vélo Bontrager Starvos Wavecel Jaune passe sous les 60 € chez Alltricks soit une baisse d'environ 17% sur le prix habituellement constaté. C'est actuellement l'un des meilleurs produit de notre comparatif.,Rick,le casque vélo bontrager starvos wavecel jaune passe sou le 60 chez alltricks soit une baisse 17 sur le prix habituellement constaté actuellement de meilleurs produit de notre comparatif,actualité bon plan le casqu vélo bontrag starvo wavecel jaun 5 étoil à
"Actualité : Bon plan – Le téléviseur LG 65G3 ""5 étoiles"" à 1 290,00 € (-28%)",Le téléviseur LG 65G3 passe sous les 1300 € chez Fnac.com soit une baisse d'environ 28% sur le prix habituellement constaté. C'est actuellement le meilleur produit de notre comparatif.,Rick,le téléviseur lg 65g3 passe sou le 1300 chez soit une baisse 28 sur le prix habituellement constaté actuellement le meilleur produit de notre comparatif,actualité bon plan le téléviseur lg 65g3 5 étoil à 1
"Actualité : Black Friday 2024 – Le téléviseur Philips 65OLED909 ""5 étoiles"" à 2 290,00 € (-14%)",Le téléviseur Philips 65OLED909 passe sous les 2300 € chez Son-Video.com soit une baisse d'environ 14% sur le prix habituellement constaté.,Rick,le téléviseur philip 65oled909 passe sou le 2300 chez soit une baisse 14 sur le prix habituellement constaté,actualité black friday 2024 le téléviseur philip 65oled909 5 étoil à 2
Actualité : iPhone 17 : Apple pourrait bien placer Face ID sous l’écran,"Face ID sous l’écran des iPhone, c’est une rumeur que l’on entend depuis un moment. À en croire un média spécialisé Apple, le projet pourrait bien aboutir en 2025 avec les iPhone 17, potentiellement sur les modèles Pro Max ou Air.",Alexandre Scotti,face id sou l écran de iphone c est une rumeur que l entend depuis un moment à en croire un média spécialisé apple le projet pourrait bien aboutir en 2025 avec le iphone 17 potentiellement sur le modèles pro max ou air,actualité iphon 17 appl pourrait bien placer face id sou l écran
Live Black Friday : vous avez des chances de gagner un aspirateur Roborock !,Préparez-vous à vivre un Black Friday phénoménal rempli de cadeaux à l’occasion de notre Live shopping inédit en partenariat avec 4 marques très appréciées.,Partenaire,à vivre un black friday phénoménal rempli de cadeaux à l occasion de notre live shopping inédit en partenariat avec 4 marque très appréciées,live black friday vou avez de chanc de gagner un aspirateur roborock
Liseuses : quel modèle choisir en 2025 ?,"Vous voulez vous (re)mettre à la lecture sans encombrer votre bibliothèque d'épais volumes de papier ? Voici notre sélection de liseuses, pour tous les profils et tous les budgets.",Amandine Jonniaux,vous voulez vous mettre à la lecture sans encombrer votre bibliothèque volume de papier voici notre sélection de liseuses pour tous le profils et tous le budget,liseus quel modèl choisir en 2025
"Actualité : Black Friday 2024 – Le téléviseur Philips 65OLED909 ""5 étoiles"" à 2 290,00 € (-11%)","Le téléviseur Philips 65OLED909 passe sous les 2300 € chez Boulanger.com, Son-Video.com et Cobra soit une baisse d'environ 11% sur le prix habituellement constaté.",Rick,le téléviseur philip 65oled909 passe sou le 2300 chez et cobra soit une baisse 11 sur le prix habituellement constaté,actualité black friday 2024 le téléviseur philip 65oled909 5 étoil à 2
"Actualité : Pour son écran pliable en trois parties, Samsung pourrait intégrer une batterie d'un tout nouveau genre","Pour offrir une meilleure batterie à ses modèles pliables, Samsung travaillerait sur une batterie elle-même pliable. C'est du moins ce que révèle un brevet déposé par le géant sud-coréen.",Benoit Bayle,pour offrir une meilleure batterie à s modèles pliables samsung travaillerait sur une batterie pliable du moins ce que révèle un brevet déposé par le géant,actualité pour son écran pliabl en troi parti samsung pourrait intégrer une batteri tout nouveau genr
"Actualité : En 2025, pour ses TV LG va jouer à fond la carte QNED en s'inspirant de ses gammes Oled","Si LG n'abandonne pas (encore ?) l'OLED pour ses téléviseurs, son haut de gamme passera également en 2025 par du LCD sérieusement boosté.",Antoine Roche,si lg pa encore pour s téléviseurs son haut de gamme passera également en 2025 par du lcd sérieusement boosté,actualité en 2025 pour se tv lg va jouer à fond la cart qned en de se gamm ole
